,category,ttc
144,公告,所經 建課 誠徵 約僱 人員   辦事員 職代   一名 主辦單位   新店 區公所 公告 日期     NUM       NUM       NUM     公告 事項   徵才 機關   新北市 新店 區公所   人員 區分   人員   官職   職稱   約僱 人員   辦事員 職代   職系   名額     NUM     性別     工作 地點     NUM     新北市   有效 期間     NUM       NUM       NUM       NUM       NUM       NUM     資格 條件     NUM     高級 中等學校 以上 畢     NUM     無 公務人員 任用 法   NUM   條 迴避 任用     NUM   條 任用 情事     NUM     熟悉 電腦 文書處理 操作     NUM     品性 端正   態度 誠懇   主動 積極   具 服務 熱忱   工作 項目     NUM     辦理 經建 行政 相關 業務     NUM     辦理 臨時 交辦 事項   工作 地址   新北市 新店 區北 新路   NUM   段   NUM   號   NUM   樓   聯絡   ENG       ENG     聯絡 方式   含檢具 文件     NUM     請於   NUM   年   NUM   月   NUM   日前 郵戳 憑將 甄選 報名表   請 新店 區公所 網站   首頁   檔案 下載   人事室 下載 新北市 新店 區公所 約僱 人員 甄選 報名表   國民 身分證   正反面 影本   最高 學歷 畢業證書   退伍令 免役 證明 證件 影本 掛號 郵寄 新店 區公所 人事室   新北市 新店 區北 新路   NUM   段   NUM   號   NUM   樓   並於 信封 註明 應徵   經建課 辦事員 職代     NUM     本項 甄審 應徵 人員 中 擇優 通知 面試   合則 錄取   增列 後 補 人員   NUM       NUM   名   後 補 期間   NUM   月   甄審 確定 翌日 算   惟 應徵 人員 不適 當時   所得 予 缺   應徵 資料 恕不退還     NUM     薪資   月薪   NUM   元     NUM     工作 期間   報到 日起   NUM   年 特種 考試 地方 政府 公務人員 考試 錄取 人員 報到 前   NUM   日止     NUM     聯絡人   石 小姐   聯絡 電話     NUM   轉   NUM     新北市 新店 區公所 約僱 人員 甄選 報名表   請 點選 下載   
145,公告,新北市   NUM   屆   醫療 公益 獎   評選 表揚   頒獎 日期 獎項     NUM   年   NUM   月   NUM   日   週日   舉行   獎項 區分 組   醫療 貢獻獎   醫療 教育 研究 獻獎   醫療 特殊 奉獻 獎   醫事 服務 貢獻獎   醫事 教育 研究 獎及 醫事 特殊 奉獻 獎等 六類   醫療機構 組     推薦 日期   自本 要點 公布 日起   NUM   年   NUM   月   NUM   日   星期五   止     推薦 對象   請於   NUM   年   NUM   月   NUM   日   星期五   前將 推薦 應檢具 推薦表   NUM   份 佐證 資料   含 工作 照片   NUM       NUM   張   照片   NUM       NUM   張   併 電子 檔 送達 本所   郵戳   俾利本 後續 作業     相關 訊息 公布 新北 市政府 衛生局 網站 首頁   活動 訊息     ENG       ENG       ENG       ENG       ENG       ENG     活動 相關 事宜 詢問 請洽 醫事 管理科 徐小姐   聯絡 電話     NUM       NUM   分機   NUM     發佈 課室   民政 課 
146,影劇、展覽,  巨大 投影     ENG     建築   城鄉   空間   插畫 設計 藝術展   系列 活動   歡迎 踴躍 參與   服務 時間 聯絡 資訊     展覽 時間   週二 週日 上午   NUM   時至 下午   NUM   時   週一 休館     展覽 地址   臺北市 中正 區 南海路   NUM   號     洽詢 電話     NUM       NUM   分機   NUM     NUM     詳細 活動 訊息 請參閱 臺灣 藝術館 網站     ENG       ENG       ENG       ENG       ENG     查詢   發佈 課室   人文 課 
147,休閒,  NUM   新北 健康 三寶   金山 甘藷 節 活動 期間     NUM       NUM       NUM       NUM       NUM       NUM   活動 場次     NUM       NUM       NUM       NUM       NUM       NUM       NUM       NUM       NUM       NUM   發布 單位   金山 區公所 類     交通 觀光 主辦單位   新北市 金山 區公所 活動 內容     NUM     田園 焢 窯 體驗     NUM     農夫 市集     NUM     舞台 表演     NUM     挖 甘藷 體驗     NUM     藷 星星 活動 是否 報名   是否 付費     ENG   否 費用   焢 窯 一窯   NUM   元     NUM   人含 田園 烤肉 體驗   限制 人數   報名 說明   焢 窯 需 事先 報名 活動 場地   新北市 金山區 玉爐路 及陽金 公路 交叉口 旁 農地   陽金 公路   NUM       NUM     ENG   處   活動 地址   新北市 金山區 南勢   NUM   號   地圖   交通 說明     NUM     皇嘉 客運   金山   陽明山   台北   金山 消防 分隊 站 下車 再 往陽金 公路 頭 步行   NUM   分鐘 即可 到達     NUM     基隆 客運     NUM   基隆   金山     NUM   基隆   淡水     NUM   金山   板橋     NUM   金山   臺灣大學   金山 區公所 站 下 搭 活動 接駁 車至 會場     NUM     國光 客運   金青   台北   法鼓山   台北   金山 區公所 站 下 搭 活動 接駁 車至 會場     NUM     淡水 客運     NUM   淡水   金山   金山 區公所 站 下 搭 活動 接駁 車至 會場     NUM     基隆 方向 前來   中山 高由 八堵   北二高 大武 崙 下 交流 道   基金 公 萬里 區   到達 金山區 沿環金路 至陽 金 公路 轉彎 即可 到達     NUM     台北市 區 前來   沿陽金 公路 下 陽明山 國家 公園   即可 金山區 沿陽金 公路   NUM       NUM     ENG   處 即可 到達     NUM     淡水 方向 前來   沿登輝 大道 走 台二省 道經 三芝 區   石門 區   到達 金山區 沿環金路 至陽 金 公路 轉彎 即可 到達   連絡 人   江峻 碩 聯絡 電話     NUM   電子信箱     ENG     NUM       ENG       ENG       ENG       ENG   
148,公告,中華 道統 慈惠 協會 第二 十一屆 全國 松柏 獎 實施辦法 推薦 表格 中華 道統 慈惠 協會 第二 十一屆 全國 松柏 獎 實施辦法 推薦 表格 
149,影劇、展覽,  巨大 投影   NUM     建築   城鄉   空間   插畫 設計 藝術展   系列 活動 一覽表 說明   本展 服務 時間 聯絡 資訊     展覽 時間   週二 週日 上午   NUM   時至 下午   NUM   時   週一 休館     展覽 地址   臺北市 中正 區 南海路   NUM   號     洽詣 電話     NUM       NUM   分機   NUM     NUM       詳細 活動 訊息 請參閱 所附 活動 一覽表   逕 本館 網站     ENG       ENG       ENG       ENG       ENG     查詢   巨大 投影     ENG     建築   城鄉   空間   插畫 設計 藝術展 活動 一覽表 
150,影劇、展覽,轉知   巨大 投影     ENG     建築   城鄉   空間   插畫 設計 藝術展   巨大 投影   NUM     建築 空間 插畫 設計 藝術展   專題講座 第一場 講座 題目   城市 夾縫 中 舊時 記憶   燃燒   古蹟 講座 地點   國立 臺灣藝術 教育館 南海 書院 美學 空間 講座 日期   時間     NUM   年   NUM   月   NUM   日   下午   NUM       NUM       NUM       NUM   第二場 講座 題目   歷史 記憶 斷層   米 軍來襲   臺北 空襲     NUM     週年 講座 地點   國立 臺灣藝術 教育館 南海 書院 美學 空間 講座 日期   時間     NUM   年   NUM   月   NUM   日   下午   NUM       NUM       NUM       NUM   相關 網址     ENG       ENG       ENG       ENG       ENG       ENG       ENG       NUM       ENG       NUM       ENG       NUM   
151,公告,  NUM   新北市 中型 徵才 活動   中和場   NUM   月   NUM   日 中 區公所   NUM   樓 禮堂 舉辦     NUM   新北市 中型 徵才 活動   中和場   歡迎 參加   新北 市政府 就業 服務處   NUM   月   NUM   日     上午   NUM   時   NUM   分假 中 區公所   NUM   樓 禮堂 舉辦     NUM   新北市 中型 徵才 活動   中和場   現場 邀請 餐飲業   製造業   服務業   NUM   家 以上 廠商   提供 超過   NUM   工作 機會   詳情 電洽   NUM       NUM     
152,公告,新北市 家庭教育 中心   家庭教育 諮詢 專線 暨 個別 化 親職教育 志工 招募 培訓   歡迎 報名 新北市 家庭教育 中心     NUM       NUM   家庭教育 諮詢 專線 暨 個別 化 親職教育 志工 招募 培訓   錄取 人員 計   NUM   小時 免費 培訓 課程   報名 自即日起   NUM   年   NUM   月   NUM   日前     ENG   報名表     ENG     NUM       ENG       ENG     可至 新北市 家庭教育 中心 網站     ENG       ENG       ENG       ENG       ENG     查詢 報名 訊息   
153,公告,洗錢 防 制法 新制 施行 對民眾 影響 問答集 配合   NUM   年   NUM   月   NUM   日 修正 施行 洗錢 防 制法 新制   檢附   洗錢 防 制法 新制 施行 對民眾 影響 問答集   電子 檔   自行 參閱   下載   洗錢 防 制法 新制 施行 對民眾 影響 問答集 
154,休閒,臺東縣 太麻里 鄉   NUM   太麻里 金針 山 金針 花季 臺東縣 太麻里 鄉   NUM   太麻里 金針 山 金針 花季   詳情請 活動 官網     ENG       ENG       ENG       ENG       ENG       ENG     ENG       ENG       ENG     ENG       NUM   
155,教育,新北 市政府   樂性平   著色 趣   愛 閱讀   親子 彩繪 活動   歡迎 報名 新北 市政府 訂於   NUM   年   NUM   月   NUM   日 辦理   樂性平   著色 趣   愛 閱讀   親子 彩繪 活動   上網 至新北 市政府 人事處 網站 最新消息 區 瞭解 活動 資訊   歡迎 報名 參加   
156,教育,新北市 三芝 區   NUM   年 高風險 家庭 整合型 跨界 安全網 服務 溫心 天使 暨 性別 意識 培力 種子 人員 訓練 新北市 三芝 區   NUM   年 高風險 家庭 整合型 跨界 安全網 服務 溫心 天使 暨 性別 意識 培力 種子 人員 訓練 開會時間     NUM   年   NUM   月   NUM   日   星期二   下午   NUM   時   NUM   分 開會地點   新北市 三芝 區公所   NUM   樓 會議室 
157,休閒,新北市 客家 文化 園區   NUM   週年 慶 活動   歡樂 客城慶園 慶 活動   新北 市政府 客家 事務局 訂於   NUM   年   NUM   月   NUM   日   星期六     NUM   月   NUM   日   星期日   新北市 客家 文化 園區 辦理 新北市 客家 文化 園區   NUM   週年 慶 活動   歡樂 客城慶園 慶 現場 將有 兒童 劇團 表演   客藝 好 好玩 客家 藝文 巡迴 列車 表演   ENG   活動   客城 遊樂園   街頭 藝人 客家 抓週 系列 活動   現場 備有 限量 客家 點心 供 參加 民眾 饗     本次 活動 亦 客家 抓週 客家 藝文 分組 體驗   需 報名 參加   名額有限   額滿 為止   報名 網址     ENG       ENG       ENG       ENG     NUM     ENG     NUM     ENG     相關 疑問請 來電 洽詢     NUM       NUM     
158,文藝,  NUM   園區 再生 玩藝 節   藝起 玩 劇場 曾 法國 亞維儂 藝術節 演出   並獲 四星 劇評 沙丁 龐客 劇團   重現 光影 奇幻 之作   格列佛 遊記   取材 生活 再生 物件   以默劇   體操   意象 式 場景   現場 即時 投影   演繹 充滿 驚奇 虛幻 世界   開啟 格列佛 冒險 旅程   帶給 孩童 無限 想像 空間   
159,公告,  NUM   年   NUM   月   NUM   月份 水源 自來水 水質 檢驗 自來水 水質 問題 說明   NUM   年   NUM   月   NUM   月份 水源 自來水 水質 檢驗   NUM   年   NUM   月   NUM   月份 自來水 水質 問題 說明 
160,公告,發布 標題     NUM       NUM   家庭教育 諮詢 專線 暨 個別 化 親職教育 志工 招募 培訓     NUM       NUM   家庭教育 諮詢 專線 暨 個別 化 親職教育   志工 招募 培訓 暨 服務 訊息   鼓勵 家庭教育 推展 諮詢 輔導 興趣 踴躍 參加   
161,影劇、展覽,三峽 歷史文物 館 舉辦   色藝   染   特展 配合 藍染節 系列 活動   歷史文物 館 展出   色藝   染   特展   邀請 藍染 工作室   團體 展出 各式各樣 藍染及 植物 染 作品   歡迎 蒞臨 參觀   
162,公告,第十屆 全國 法規 資料庫 法規 知識 王 網路 闖關 創意 教學 競賽 主辦單位   法務部 廉政 署 公告 日期     NUM       NUM       NUM   發文 字號   廉 預字   NUM   號函   公告 事項   詳情 請參閱 第十屆 全國 法規 資料庫 法規 知識 王 網路 闖關 競賽 要點 第十屆 全國 法規 資料庫 創意 教學 競賽 要點   
163,公告,農委會 林務局 預告 修正   適用 野生動物 保育 法 人工 飼養   繁殖 野生動物 種類   修正 草案 公告   適用 野生動物 保育 法 人工 飼養   繁殖 野生動物 種類   修正 草案 公告 
164,公告,  公有 接受 補助 文化 資產 資料 公開 辦法   發布 施行   公有 接受 補助 文化 資產 資料 公開 辦法   業經 文化部 中華民國   NUM   年   NUM   月   NUM   日以 文授 資局 綜字   NUM   號令 發布 施行   下載 檔案   文化部   令 公有 接受 補助 文化 資產 資料 公開 辦法 條文 公有 接受 補助 文化 資產 資料 公開 辦法 總 說明 
165,教育,  NUM       NUM   家庭教育 諮詢 專線 暨 個別 化 親職教育 志工 招募 培訓   NUM       NUM   家庭教育 諮詢 專線 暨 個別 化 親職教育   志工 招募 培訓 暨 服務 訊息   鼓勵 家庭教育 推展 諮詢 輔導 興趣 踴躍 參加   
166,文藝,  NUM   淡水 古蹟 夜 未眠 暑期 體驗 營 內容   暑假 熱門 兩天 一夜 夏令營 活動   帶領 國 小 三年級 六年級 學童 領略 淡水 人文 精彩   夜宿 小 白宮   教士 會館 晚宴   淡水 百年 音樂 軒社 南北 軒 認識 臺灣 傳統 北管 音樂     NUM     ENG   列印 創客 體驗   兩天 一夜 古蹟 夜 未眠 將給 學童 帶來 新 舊 淡水 難忘 夏日 回憶   
167,教育,  新北 市立 圖書館 萬里 分館   週二 樂齡 日   學習   ENG   內容   新北 市立 圖書館 萬里 分館   週二 樂齡 日   學習   ENG     活動 時間     NUM       NUM         NUM       NUM       NUM       NUM     活動 地點   新北 市立 圖書館 萬里 分館   閱覽室   新北市 萬里 區 瑪 鋉 路   NUM   號   NUM   樓   講師   新北市 資訊中心 講師 群   報名 電話     NUM       NUM       NUM   分機   NUM     活動 內容   使 資訊 普及   本館 特別 新北市 資訊中心 結合 推出 一系列 數位 學習 課程   偏鄉 居民 享受 現代 資訊 便利   凡 持有 新北 市立 圖書館 借閱 證之 讀者 即可 免費 報名 參加   限額   NUM   位   額滿 為止 喔   
168,教育,  新北 市立 圖書館 金山 分館   週二 樂齡 日   學習   ENG   內容   新北 市立 圖書館 金山 分館   週二 樂齡 日   學習   ENG     活動 時間     NUM       NUM         NUM       NUM       NUM       NUM     活動 地點   新北 市立 圖書館 金山 分館     NUM     ENG   團體 視聽 區   新北市 金山區 龜子山   NUM   號   講師   新北市 資訊中心 講師 群   報名 電話     NUM       NUM       NUM       NUM     活動 內容   使 資訊 普及   本館 特別 新北市 資訊中心 結合 推出 一系列 數位 學習 課程   偏鄉 居民 享受 現代 資訊 便利   凡 持有 新北 市立 圖書館 借閱 證之 讀者 即可 免費 報名 參加   限額   NUM   名   額滿 為止 喔   
169,影劇、展覽,  新北 市立 圖書館 三芝 分館     NUM   月樂齡 電影院 內容   新北 市立 圖書館 三芝 分館     NUM   月樂齡 電影院   播映 時間     NUM       NUM         NUM       NUM       下午   NUM       NUM     播映 地點   新北 市立 圖書館 三芝 分館     NUM   樓 團體 視聽室   新北市 三芝 區淡金路 一段   NUM   號   聯絡 電話     NUM       NUM       NUM     放映 日期   電影 名稱   分級   片長     NUM       NUM       天堂 顏色   普     NUM   分   伊朗   劇情     NUM       NUM       永不 妥協   護     NUM   分   美國   劇情   歡迎 蒞臨 觀賞   
170,休閒,  新北 市立 圖書館 新莊 裕民 分館     NUM   年   閱讀   ENG   一夏   暑期 陪讀 活動 內容   新北 市立 圖書館 新莊 裕民 分館     NUM   年   閱讀   ENG   一夏   暑期 陪讀 活動   課程內容   新北 市立 圖書館 今年 性別 平等 主題   提供 學童 暑假 期間 多元 學習 課程   活動 結束 後 亦 提供 弱勢 學童 幸福 餐券   課程 地點   新莊 裕民 分館   NUM     ENG   兒童 室   課程 對象   國 小   NUM     NUM   年級 學童   新 住民 弱勢 學童 優先 受理   課程 時間     NUM   年   NUM   月   NUM   日起   NUM   月   NUM   日止 每週 二至 週五 下午   NUM   時至   NUM   時   每日   NUM   小時 主題 活動     NUM   小時 寫 暑假作業   報名 方式     NUM   年   NUM   月   NUM   日起   電話 臨櫃 報名   新莊 裕民 分館 收取   NUM   名     NUM       NUM   年   NUM   月   NUM     NUM   月   NUM   日新 住民 弱勢 學童   低收入 戶   中低收入 戶   社會局 轉介 高風險 學童   優先 報名     NUM       NUM   年   NUM   月   NUM   日起   開放 學童 報名   額滿 為止   報名 電話   新莊 裕民 分館     NUM       NUM     課程內容     NUM   月   NUM   日       NUM       NUM       NUM       NUM     創意 環保 小 燈籠     NUM   月   NUM   日       NUM       NUM       NUM       NUM     手工 打皂課     NUM   月   NUM   日       NUM       NUM       NUM       NUM     益智 桌遊     NUM   月   NUM   日       NUM       NUM       NUM       NUM     海底 世界   素描畫     NUM   月   NUM   日       NUM       NUM       NUM       NUM     手工 打皂課   護脣膏     NUM   月   NUM   日       NUM       NUM       NUM       NUM     魔法 故事 屋     NUM   月   NUM   日       NUM       NUM       NUM       NUM     花 蝴蝶   水彩畫     NUM   月   NUM   日       NUM       NUM       NUM       NUM     小小 館員 日     NUM   月   NUM   日       NUM       NUM       NUM       NUM     毛學伴   愛 閱讀     NUM   月   NUM   日       NUM       NUM       NUM       NUM     益智 桌遊     NUM   月   NUM   日       NUM       NUM       NUM       NUM     多元 性別 家家 遊     NUM   月   NUM   日       NUM       NUM       NUM       NUM     創意 剪紙   ENG       NUM   月   NUM   日       NUM       NUM       NUM       NUM     神隱 少女   電影院     NUM   月   NUM   日       NUM       NUM       NUM       NUM     恐龍 當家   電影院     NUM   月   NUM   日       NUM       NUM       NUM       NUM     瓶 中花   水墨畫   備註     NUM     報名 後 需 連續 參加   接受 單堂 課程 報名     NUM     每日   NUM   小時 主題 活動     NUM   小時 寫 暑假作業   
171,教育,  新北 市立 圖書館 新莊 中港 分館     NUM   年   閱讀   ENG   一夏   暑期 陪讀 活動 內容   新北 市立 圖書館 新莊 中港 分館     NUM   年   閱讀   ENG   一夏   暑期 陪讀 活動   課程內容   新北 市立 圖書館 今年 性別 平等 主題   提供 學童 暑假 期間 多元 學習 課程   活動 結束 後 亦 提供 弱勢 學童 幸福 餐券   課程 地點   新莊 中港 分館   NUM     ENG   多功能 教室   課程 對象   國 小   NUM     NUM   年級 學童   新 住民 弱勢 學童 優先 受理   課程 時間     NUM   年   NUM   月   NUM   日起   NUM   月   NUM   日止 每週 二至 週五 下午   NUM   時至   NUM   時   每日   NUM   小時 主題 活動     NUM   小時 寫 暑假作業   報名 方式     NUM   年   NUM   月   NUM   日起   電話 臨櫃 報名   新莊 中港 分館 收取   NUM   名     NUM       NUM   年   NUM   月   NUM     NUM   月   NUM   日新 住民 弱勢 學童   低收入 戶   中低收入 戶   社會局 轉介 高風險 學童   優先 報名     NUM       NUM   年   NUM   月   NUM   日起   開放 學童 報名   額滿 為止   報名 電話   新莊 中港 分館     NUM       NUM     課程內容     NUM   月   NUM   日       NUM       NUM       NUM       NUM     益智 桌遊     NUM   月   NUM   日       NUM       NUM       NUM       NUM     海底 世界   素描畫     NUM   月   NUM   日       NUM       NUM       NUM       NUM     神偷 奶爸   NUM     電影院     NUM   月   NUM   日       NUM       NUM       NUM       NUM     手工 打皂課     NUM   月   NUM   日       NUM       NUM       NUM       NUM     花 蝴蝶   水彩畫     NUM   月   NUM   日       NUM       NUM       NUM       NUM     益智 桌遊     NUM   月   NUM   日       NUM       NUM       NUM       NUM     創意 剪紙   ENG       NUM   月   NUM   日       NUM       NUM       NUM       NUM     性福 家庭   NUM   種 想像     NUM   月   NUM   日       NUM       NUM       NUM       NUM     瓶 中花   彩繪 水墨畫     NUM   月   NUM   日       NUM       NUM       NUM       NUM     冰原 歷險記   NUM     電影院     NUM   月   NUM   日       NUM       NUM       NUM       NUM     益智 桌遊     NUM   月   NUM   日       NUM       NUM       NUM       NUM     魔法 故事 屋     NUM   月   NUM   日       NUM       NUM       NUM       NUM     手工 打皂課   護脣膏     NUM   月   NUM   日       NUM       NUM       NUM       NUM     大力士 阿羅 夏   電影院     NUM   月   NUM   日       NUM       NUM       NUM       NUM     魔法 故事 屋   報名 後 需 連續 參加   接受 單堂 課程 報名   每日   NUM   小時 主題 活動     NUM   小時 寫 暑假作業   
172,影劇、展覽,  新北 市立 圖書館 淡水 分館     NUM   月 電影 爆米花 內容     NUM   月 電影 爆米花   地點   淡水 分館   NUM   樓 多功能 活動室   淡水區 文化路   NUM   號   電話     NUM       NUM       NUM   分機   NUM       NUM     電影 放映 時間     NUM       NUM     假日 電影院     NUM       NUM     日   怪獸 大學   普     NUM   分     NUM       NUM     日   移動 迷宮   焦土 試煉   護     NUM   分     NUM       NUM     日   馴龍 高手   普     NUM   分     NUM       NUM     日   偷走 五年   普     NUM   分     NUM       NUM     日   馴龍 高手   NUM     普     NUM   分   樂齡 電影院     NUM       NUM       四海 老傢伙   護     NUM   分     NUM       NUM       歡迎 來到 德國   普     NUM   分   備註   影片 前有 加註   卡通 動畫片 
173,教育,  汐止 大同 分館     NUM   月 原住民 文化 研習 課程   泰雅族   織布 手機袋   內容   原住民 婦女 最讓人 印象 深刻   莫過於 高超 手工 織布 技藝   各色 紗線 經緯分明   交錯   編織成 色彩 搶眼   手機袋   筆袋   背包   實用 物品   透過 編織 傳遞 家人 祝福 愛   講師   黃 瑋 瑤   新北市 原住民 家庭 關懷 協會   時間     NUM       NUM       NUM       NUM         NUM       NUM       NUM       NUM     地點   汐止 大同 分館     ENG     NUM   原住民 文化 學習 教室   汐止 區 大同路   NUM   段   NUM   號   洽詢 電話     NUM       NUM       NUM       NUM   顏 小姐   材料費   NUM   元   限額   NUM   名   臨櫃 報名 
174,文藝,  新北 市立 圖書館 淡水 分館   青少年 表演藝術 聯盟   第十七屆 花樣年華 青少年 戲劇節   內容   青少年 表演藝術 聯盟   第十七屆 花樣年華 全國 青少年 戲劇節   勇氣 之舟   時間     NUM       NUM       NUM       NUM       NUM       NUM       NUM       NUM       NUM       NUM       NUM       NUM       NUM       NUM       NUM       NUM     下午   NUM       NUM   入場     NUM       NUM   演出   地點   淡水 分館   NUM   樓 演藝 廳   淡水區 文化路   NUM   號   電話     NUM       NUM       NUM   分機   NUM     許 小姐   簡介     NUM     場 青少年 全國 選拔賽 中 脫穎而出 自創 舞臺劇   獲得 眾多 劇評人   劇場 導演   教育工作者 盛讚     NUM     屆 花樣 戲劇節   歡迎 一同 欣賞 青少年 創作 能量   備註   無須 索票   免費入場 
175,文藝,新北市 雙溪 區 辦理     NUM   年 婦女 成長 課程   活力 簡易 有氧 舞蹈 進階 班   內容   活力 有氧 舞蹈 課程   結合 有氧 舞蹈 活潑 變化 舞步   藉由 音樂 動作 配合 有氧 運動 有效 增進 身體 協調 感   平衡感 柔軟度   達到 娛樂   塑身 目的   更能 帶給 健康 歡樂 成效   
176,休閒,濕地 故事 館 套裝 行程 內容   想 知道 濕地裡 發生 新鮮事   周休 二日   是否 想 遠離 塵囂   一窺 大自然 奧秘   濕地 故事 館 套裝 行程 內容 包括 故事 館 導覽   手作   ENG   實地 走訪 人工 濕地 唷   
