,category,ttc
0,休閒,阿公 阿嬤 俱樂部 開張 囉   大林 銀髮 俱樂部 服務   新北市 訊   這遺世 獨立 山城   坪林   依山傍水   茶香 四溢   梯田 裡 隨處可見 彎腰 身影   信手拈來 鮮嫩 茶葉   阿公 阿嬤們 今天 齊聚 大林 銀髮 俱樂部   共同 見證 銀髮族 新 樂園 啟用   活動 中   松年 大學 舞蹈班 化身 癡情 玫瑰花   歌唱 班 思念 海岸邊 想念 當年 伊人   阿公 阿嬤 熱情 活力   融化 冬季 寒冷   溫暖 心   全球 邁入 高齡 社會   台灣 亦 這波 高齡 化 列車 之中   邁入 超 高齡 社會   台灣 老年人 口 預計   NUM   萬人   因應 高齡 化 社會   新北 市政府 擬定   活躍 老化   養   積極 推動 新北市 各里 成立 銀髮 俱樂部   本區   NUM   年 相繼 成立 四間 銀髮 俱樂部 後   今年 再 新增 大林 銀髮 俱樂部   本區 再添 新 據點   坪林 區長 呂學記   議員 代表 阿公 阿嬤 一同 拉 下 紅布   轟隆轟隆 砲 聲 中 歡喜 揭牌   呂 區長 表示   山區 中 長輩 走出 家門   擴大 生活圈   積極 實現 里 一處 銀髮 俱樂部 目標   本區 每位 長者 就近 使用 休閒 設備 共餐 結交 朋友   提升 精神 生活   愈 老愈 健康   長輩 健康 晚輩 福氣   健康   活躍 老化 現在 未來 重要 使命   附件     ENG     NUM       ENG     NUM       ENG     NUM       ENG   
1,休閒,心手 相連   愛相隨   資深 優良 志工 愛心 服務站 代表 表揚大會   新北市 訊   新北 市政府 教育局 表揚 長期 學校 奉獻 心力 志 工們   於今     NUM     日 新北 市政府   NUM   樓 多功能 集會 堂 舉辦     NUM   年度 各級 學校 資深 優良 志工及 愛心 服務站 代表 表揚大會   副 市長 侯友宜 頒獎   共計   NUM   位 人員 接受 表揚   包括 長期 學校 奉獻 心力   足為 眾人 楷模   杏福志工     NUM   位   學校 資深 優良 志工   NUM   位   優良 愛心 服務站 代表   NUM   位   副 市長 侯友宜 表示   志工 能量 多寡 代表 國家 社會 進步 幸福 象徵   社會 越 先進 越 幸福   投入 志工 能量 越   打造 充滿 幸福 城市   正是 新北 市政府 年來 孜孜不倦 目標   希望 全體 市民 感受 無限 愛與 關懷   了將 幸福 化為 真實   教育 園地 裡   教育 人員 奉獻 自我   行動 感召 學生 一起 改變 世界 外   一群 求 回報 熱心 志工   無私 愛 成就 學子 健康   安全   關愛 希望 環境 裡   快樂 學習   健康成長   獲獎   NUM   位杏福志工   最 資深 志工 奶奶 新莊 區裕 民國 小葉 呂尚 奶奶     NUM   年前 她剛 做好 化療   義不容辭 投入 導護 志工   協助 維護 學童   下學 安全   三重 區 二重 國小 王林 寶華 女士   長年 遭受 富貴手 之苦   仍帶 手套 參與 圖書館 相關 工作   服務 不落人後   樂於 志工 服務 工作   服務 高達   NUM   單位   板橋 區 中山 國小陳金連 女士 社區 煎 蔥油餅 維生   收入 雖不豐   定期 捐助 學校 經費   擔任 志工 支援 學校 各項 活動   若有 小朋友 肚子餓   卻 沒帶 錢   發揮 人飢己飢 精神   請 孩子 吃 蔥油餅   鼓勵 弱勢 學童 努力 向學   學生 感受 蔥油餅 阿嬤 愛心   目前 新北市 各級 學校 志工 人數 已近   NUM   萬人   不求名利 服務 社會   參與 交通 導護   環保 業務   晨間 故事   圖書 管理   認輔 工作   健康 中心   公物 修護   環境 綠 美化 工作   發揮 志工 愛心   轉動 愛   共同 打造 幸福 校園   營造 愛的 社會   副 市長 侯友宜 感佩 本市 所有 志工 朋友   踴躍 投入 志願 服務 行 列   積極 散播 愛的 種子   共同 協助 校園 增進 社會 祥 奉獻 心 力   期待 人 加入 志工 行列   秉持   人 生命 改善     群體 貢獻 心力   信念   生命 發揮 最大 價值   資料 詳洽   教育局 特殊教育 科   陳 怡帆科   長   電話     NUM   分機   NUM   教育局 特殊教育 科   王耀德 輔導員   電話     NUM   分機   NUM     相關 圖片   
2,休閒,新北市   NUM   礦山 樂活 文化 健走 透過 健走 活動 黃金 志工 引導 解說   角度 認識 金瓜石   感受 山城 獨特 風貌   健走 結合 淨山 活動 周邊 環境保護 一分 心力     NUM       NUM   報名   額滿 為止   日期     NUM   月   NUM   月   NUM   場次   費用     NUM   元   含 礦工 便當   鐵盒 款   五坑 體驗     親子 一起 報名   優惠 報名費 每人   NUM   元   報名 專線     NUM       NUM     
3,文藝,綻放   新生代 金工 創作 聯展 本展 邀請   NUM   位 年輕   勇於 世界 發聲   接軌 國際 臺灣 新生代 金工 創作者   包括 陳 郁君   江枚芳   李恆   陳 映秀   吳淑麟   趙 永惠   作品 一窺 台灣 當代 金工 新生代 創作 成果   
4,文藝,淡水 海關 碼頭 園區   玩藝 關頭   週末 藝術 趴   營造 淡水 海關 碼頭 園區 為民眾 休憩   悠閒 放鬆 假日 去處   透過 週末 邀請 藝術   繪畫   手作 同好 現場 創作 親子 互動   免費 提供 畫具 借用   海關 碼頭 園區 成為 藝文 薈萃 之地   欣賞 淡水河 景之餘   沉浸於 藝術 氛圍 中   每月 活動 請 淡水 古蹟 博物館 網站 查詢   
5,文藝,礦山 年   開山   NUM   週年 紀念展 十六世紀 航海 時代 起即 臺灣 北部 東北部 一帶 產金   未 大規模 採金 紀錄     NUM   年代   基隆河 中 發現 砂金 引起 淘金熱   發現 九份   金瓜石 金礦 層     NUM   年 金瓜石 礦山   今 金瓜石   水 湳 洞   大規模 系統性 探礦   採礦   至今 正逢 開山   NUM   週年   本館 特別 推出   礦山 年   開山   NUM   週年 紀念展   透過 礦山 歷史沿革 照片 圖像 來訪 民眾 了解 水金 礦山 開山 至今   NUM   年 演變 發展   角度 認識 臺灣 金 礦山   開山 歷史   展區   本館 煉金樓   NUM   樓特 展室   以大 歷史觀 敘述 礦業 發展 變革 歷史 事件   透過 歷史 照片     NUM   世紀 前 臺灣 產金   開山 十週年 紀念   基隆 金山 形成   臺 陽 鑛 業 株式會社   東亞 第一 貴金屬 礦山   臺灣 金屬 鑛 業 公司 經營 時期 現今   娓娓 道 出水 金九 礦山 開山 至今   NUM   年 演變 發展   角度 傳遞 臺灣 金 礦山 人文 價值   山城 記憶   展區   金瓜石 勸濟堂   展出 老照片 徵集 成果   規劃 礦山 節慶   聚落   交通   學校   娛樂 醫療 主題     NUM   位 臺   日 耆老 提供 照片 中   看到 昔日 山城 民俗 節慶   聚落 景觀   學校 校舍   車站 已 復 景象   人 懷念   
6,文藝,  NUM   臺灣 陶藝 獎     NUM   臺灣 陶藝 獎   分為   陶藝 成就獎   陶藝 創作獎     陶藝 新銳 獎   三大 獎項   本展 展出 成就 獎得主 劉鎮洲 年輕 時 至今 經典作     NUM   件 獲 創作獎 精采 創作 新銳 獎得主 盧嬿宇   胡慧琴 近年 代表作   值得一看   
7,公告,國際 糧農組織     ENG     全球 資訊 預警系統   NUM   年   NUM   月   NUM   日 發出 特別 警訊   吳郭魚 湖泊 病函轉 行政院 農業 委員會 漁業 署 漁業 署   國際 糧農組織     ENG     全球 資訊 預警系統   NUM   年   NUM   月   NUM   日 發出 特別 警訊   吳郭魚 湖泊 病     ENG       ENG       ENG     以下 簡稱   ENG     養殖 野生 吳郭魚 中 傳播   避免 外來 病毒感染   惠請 再 加強 宣導 周知   勿 購買 來源不明 魚苗 並勿 過度 集中 高密度 放養 吳郭魚   養殖戶 發生 吳郭魚 異常 大量 死亡 情事   應立即 通報 本所 新北 市政府 動物 保護 防疫 處 防範 疫病 擴大 蔓延   發佈 課室   經建課 
8,休閒,舉辦     NUM   新北 一起 運動     ENG   起好稅   慶祝 稅務 節 活動   NUM   年   NUM   月   NUM   日   星期六   下午   NUM   時   NUM   分   NUM   時   NUM   分   新北市 新莊 體育場 林蔭大道   陽光 草坪   舉辦     NUM   新北 一起 運動     ENG   起好稅   慶祝 稅務 節 活動   摸彩 獎項 豐富   活動 詳情 刊登 本處 粉絲團   稅不著   呼叫 暗光 鳥   ENG       ENG       ENG       ENG     NUM     ENG     請多加 分享   
9,公告,  NUM   太麻里   忘憂 一夏   攝影 比賽 詳情 可至 臺東縣 太麻里 網站     ENG       ENG       ENG       ENG       ENG       ENG     ENG       ENG       ENG     ENG       NUM     查詢 
10,公告,  NUM   年   NUM   月 跨 機關 巡迴 服務項目   據點 時間 一覽表 公告 日期     NUM       NUM       NUM     公告 事項   新北市 金山 戶政事務     NUM   年   NUM   月 跨 機關 巡迴 服務項目   據點 時間 一覽表   場次   日期   服務 據點   服務 時間   服務 機關   受理 申辦 項目   注意事項     NUM       NUM   年   NUM   月   NUM   日   三芝 區古 庄里 古庄 活動中心   上午   NUM   時至   NUM   時   新北市 金山 戶政事務     印鑑 登記   證明     印鑑 變更   廢止 登記     換   補   發 國民 身分證     戶籍 登記     戶籍 資料 文件 核發     經戶 核准 辦理 事項     戶政 法令 諮詢服務     NUM       NUM   年   NUM   月   NUM   日   石門 區富 基里 漁會 辦事處   上午   NUM   時至   NUM   時   新北市 金山 戶政事務     印鑑 登記   證明     印鑑 變更   廢止 登記     換   補   發 國民 身分證     戶籍 登記     戶籍 資料 文件 核發     經戶 核准 辦理 事項     戶政 法令 諮詢服務   新北市 淡水 地政事務     地籍 清理 業務 諮詢   標售 土地 位置 資訊 查詢 解說     核發 電子 謄本     政 諮詢 業務 宣導     跨所   跨 縣市 代收 代寄 案件     預約 到府 服務 協助 申辦 案件     辦理 簡易 登記 案件     政 法令 諮詢服務   新北 市政府 稅捐稽徵 處 淡水 分處     提供 地方稅 法令 諮詢服務     宣導 資料 發送     輔導 申請 轉帳 納稅     受理 地價稅 自用 住宅 用地 申請書     受理 房屋 使用 情形 變更 申請書     受理 使用 牌照稅 免稅 申請書     捐贈 發票 送 好禮     申辦 電子 發票 手機 條碼 服務     NUM       NUM   年   NUM   月   NUM   日   萬里 區 野柳 里 漁會   上午   NUM   時至   NUM   時   新北市 金山 戶政事務     印鑑 登記   證明     印鑑 變更   廢止 登記     換   補   發 國民 身分證     戶籍 登記     戶籍 資料 文件 核發     經戶 核准 辦理 事項     戶政 法令 諮詢服務     NUM       NUM   年   NUM   月   NUM   日   金山區 磺港 里 漁會   上午   NUM   時   NUM   分   NUM   時   NUM   分   新北市 金山 戶政事務     印鑑 登記   證明     印鑑 變更   廢止 登記     換   補   發 國民 身分證     戶籍 登記     戶籍 資料 文件 核發     經戶 核准 辦理 事項     戶政 法令 諮詢服務   備註   承辦人   常子庭   聯絡 電話     NUM       NUM       NUM     分機   NUM     電子信箱     ENG     NUM       ENG       ENG       ENG   
11,公告,行政院 消費者 保護 處 編列   高齡 消費 爭議 案例 彙編   請民眾 多加 參考   主辦單位   行政院 消費者 保護 處     新 北原 社字   NUM   號 公告 事項   該處 推動 高齡 消保 教育   避免 消費者 受害   特此 編列   高齡 消費 爭議 案例 彙編   請多加 運用   詳情 逕 洽 行政院 消費者 保護 網站   資訊 服務   出版 品   短 網址   ENG       ENG       ENG       ENG     
12,公告,臺東縣 太麻里 鄉     NUM   金針 花季 系列 活動 交通管制   主辦單位   臺東縣 太麻里 鄉公所   公告 事項   公告 訊息 電子 檔 可於     NUM   金針 山 忘憂 花海 系列 活動   網站   ENG       ENG       ENG       ENG       ENG       ENG     ENG       ENG       ENG     ENG       NUM     下載   
13,休閒,  走入 石門 樂活 小 旅行   新北市 石門 區為 鼓勵 走入 石門   體驗 生活   舉辦   走入 石門 樂活 小 旅行   活動 期間     NUM   年   NUM   月   NUM       NUM   月   NUM   日 相關 活動 詳情 報名 方式 請 詳閱 報名 網址     ENG       ENG       ENG       ENG     NUM     ENG   活動 洽詢     NUM       NUM       NUM   分機   NUM   涂 先生 
14,公告,  NUM   年 十大 優秀 校園 犬 網路 票選 活動   活動 鼓勵 學校 飼養 校園 犬   學童 學習 犬貓 正確 相處   了解 犬貓 良性 互動   教導 學童 尊重 生命 動物 保護 教育 觀念     旨 揭     NUM   年 十大 優秀 校園 犬 網路 票選 活動   網址     ENG       ENG       ENG       ENG     NUM     ENG     訂於   NUM   年   NUM   月   NUM   日至   NUM   月   NUM   日 開放 網路 投票   敬請 把握 機會   鼓勵 民眾   師生 家長 踴躍 投票   選出 新北市   NUM   年度 十大 優秀 校園 犬   發佈 課室   秘 書室 
15,教育,  NUM       NUM   板橋 生活 講座   遠離 癌症   快樂 人生   板橋 訊     NUM       板橋 生活 講座   將於   NUM       NUM       晚上   NUM   點在 板橋 區公所   NUM   樓 禮堂   板橋 區府 中路   NUM   號   邀請 中央 大學生 醫 科學 工程學系 助理 教授 蘇立仁 演講   遠離 癌症   快樂 人生   社會 進步   物質享受 提升   文明 病 卻 接續而來   談   癌   色變 今日   避免 癌症 上身   拖累 家人   已成 顯學   蘇 教授 多年 鑽研 腫瘤 細胞 研究   專長 疾病基因 診斷   治療 途徑 預測 藥物 開發   擁有 美   日   星多國 專利   教授 結合 生物醫學 專業   NUM   多年 靜坐 經驗   帶給   NUM   世紀 最潮 養生 概念   講座 免費入場   現場 並有 抽獎 活動   歡迎 踴躍 參加   詳情請 板橋 區公所 全球 資訊網 查詢     ENG       ENG       ENG       ENG       ENG       ENG     電洽     NUM       NUM   轉   NUM     新北市 板橋 區公所   資料 提供   人文 課   黃 馨 儀   電話     NUM       NUM       NUM       NUM   
16,文藝,社會 法律 事件簿 短篇小說 創作 競賽   結合 社會 資源   強化 司法機關 與民眾 溝通 以促 瞭解 司法 內涵   多元 開發 法治 教育 教材   兼顧 推廣 犯罪 防治 工作   法務部 司法官 學院 爰 透過 徵求 法律 小說 文學創作   社會 大眾 司法官 工作 內容   法律 程序 理解 犯罪 防治 對策 走向 重要 議題   透過 文學創作 進一步 認識   啟發 現行制度 進行 批判 思考   促進 司法 革新 進步     申請 期限     NUM   年   NUM   月   NUM   日起   NUM   年   NUM   月   NUM   日止   郵戳     活動 訊息 建 置於 法務部 司法官 學院 犯罪 防治 研究 資料庫 網站     ENG       ENG       ENG       ENG       ENG       ENG       ENG     NUM       ENG     相關 資料 請 逕 網站   視聽 教室 專區 下載   
17,教育,內政部 移民 署 辦理   認識 臺灣   愛 寶島   活動   直播 共學   線上 課程 內政部 移民 署為 響應 政府 數位 關懷 政策   提高 新 住民 子女 資訊 應用 能力   委由承商 巨匠 電腦 股份 有限公司 辦理   認識 臺灣   愛 寶島   活動   直播 共學   線上 課程   活動 詳細 資訊 請參閱 新 住民 資訊   ENG   網     ENG       ENG       ENG       ENG       ENG     或洽 諮詢 專線   NUM       NUM       NUM   下載 檔案   活動   ENG   
18,休閒,  NUM   南投   NUM   自行車 百   ENG   挑戰賽 主辦單位   南投縣 南投市 公所 公告 日期     NUM       NUM       NUM   發文 字號   投市 文字   NUM   號函   公告 事項 
19,文藝,  相見 馨 牡丹     NUM   野 薑 花季 主辦單位   屏東縣 牡丹 鄉公所 公告 日期     NUM       NUM       NUM   發文 字號   牡 鄉農 觀字   NUM   號函   公告 事項 
20,休閒,  NUM   悠活 池上 米 鄉 竹筏 季 系列 活動   大坡 池 採蓮節   夏季 竹筏 體驗 採蓮 水上 活動 主辦單位   臺東縣 池上 鄉公所 公告 日期     NUM       NUM       NUM   發文 字號   池 鄉農 字   NUM   號函   公告 事項   相關 下載     NUM   悠活 池上 米 鄉 竹筏 季 系列 活動   大坡 池 採蓮節   夏季 竹筏 體驗 採蓮 水上 活動 
21,休閒,西湖   幸福 婚宴 小 旅行 綠能 觀光 電動 遊園 車 路線圖 詳細 內容   請 發佈 課室   經建課 
22,教育,  認識 臺灣   愛 寶島   課程 行銷 活動   活動 主題   認識 臺灣   愛 寶島   活動 期間 地點     NUM     網路 競賽     NUM       NUM       NUM         NUM       NUM       NUM         NUM     實體 競賽   台北 場   NUM       NUM       NUM     日     NUM       NUM       NUM       NUM     地點   巨匠 電腦 臺北 認證 中心 台北市 中正 區 公園路   NUM   號   NUM   樓   臺 中場   NUM       NUM       NUM         NUM       NUM       NUM       NUM     地點   巨匠 電腦 公益 認 中心 台中市 西區 公益 路   NUM   號   高雄場   NUM       NUM       NUM         NUM       NUM       NUM       NUM     地點   巨匠 電腦 鳳山 認證 中心 高雄市 鳳山 區光 遠路   NUM   號     參加 對象     NUM     臺 新 住民   新 住民 二代 子女   NUM     需為 新 住民 數位 資訊   ENG   網 會員 非會員 須先     ENG     新 住民 數位 資訊   ENG   網     ENG       ENG       ENG       ENG       ENG       ENG   完成 會員 註冊   活動 說明   相關 活動 細則   請 參考   新 住民 數位 資訊   ENG   網   活動 網頁 說明     實體 競賽 報名 方式     NUM     免 付費 報名 專線     NUM       NUM       NUM     報名 傳真     NUM       NUM       NUM   發佈 課室   人文 課 
23,公告,  NUM   年   NUM       NUM   月 徵兵 梯次 流路 預定 入營 日期 詳細 內容   請 發佈 課室   役 政災 防課 
24,公告,瑞芳 戶政   NUM   年   NUM       NUM   月 巡迴 服務   跨 機關 巡迴 服務 服務 據點 時間 一覽表   廣播稿 宣導 海報 主辦單位   新北市 瑞芳 戶政事務   公告 事項 
25,教育,    NUM     NUM   年 建構 新 住民 數位 學習 應用服務 委外案   課程 行銷 活動 主辦單位   內政部 移民 署   依據 巨匠 數位   NUM   號 公告 事項     內政部 移民 署為 響應 政府 數位 關懷 政策   提高 新 住民 子女 資訊 應用 能力   委由承商 巨匠 電腦 股份 有限公司   NUM   月   NUM   日     NUM   月   NUM   日 辦理   認識 臺灣   愛 寶島   課程 行銷 活動   直播 共學   線上 課程   提供 新 住民 參與 學習     詳細 活動 資訊 參閱   新 住民 資訊   ENG   網   網站     ENG       ENG       ENG       ENG       ENG     或洽 諮詢 專線     NUM       NUM       NUM     
26,文藝,  NUM     中 暑期 特別 活動   越 越欲試   藝起 童樂會   活動 報名 開跑 囉   今年 暑假 最後 一波   最 好玩 體驗   來場 台越 文化交流 童樂會   體驗 越南 童年 遊戲   舞蹈   說說唱唱 教 開 口說 越南話   一起 全球化 腳步 認識 國家 文化   習俗   語言   來自 國家   歡迎 一起 熱情 響應   開學 前夕   吃吃喝喝 玩 創意 交朋友   暑假 不留     NUM     時間     NUM   年   NUM   月   NUM   日     上午   NUM   時至   NUM   時     NUM       NUM   報到     NUM     地點   本所   NUM   樓 禮堂   新北市 中和區 景平路   NUM       NUM   號     NUM     對象   凡 就讀 國小及國 中學生 皆 參加   歡迎 親子 一同 參加     NUM     費用   免費     NUM     報名 方式     NUM     電話 報名     NUM       NUM       NUM   分機   NUM   洪 小姐     NUM     網路 報名     ENG       ENG       ENG       ENG       ENG     NUM     ENG     NUM     ENG     NUM     ENG     NUM     發佈 課室   人文 課 
27,休閒,新北市 中和區 辦理     NUM   年 越 越欲試   藝起 童樂會     NUM   年   NUM   月   NUM   日     上午   NUM   時至   NUM   時   活動 地點   中 區公所   NUM   樓 禮堂   新北市 中和區 景平路   NUM       NUM   號   歡迎 闔家 蒞臨 觀賞 主辦單位   新北市 中 區公所   依據 新北中 文字   NUM   號   公告 事項   倡導 多元 文化   提供 國 中小學 童 暑假 期間 活動 空間   特 舉辦 活動   相關 內容     活動 時間     NUM   年   NUM   月   NUM   日     上午   NUM   時至   NUM   時     活動 地點   中 區公所   NUM   樓 禮堂   新北市 中和區 景平路   NUM       NUM   號     對象   凡 就讀 國小及國 中學生 皆 參加   歡迎 親子 一同 參加     費用   免費   提供 點心 並有 手作 體驗 活動     報名 方式     NUM     電話 報名     NUM       NUM       NUM   分機   NUM   洪 小姐     NUM     網路 報名     ENG       ENG       ENG       ENG     NUM     ENG       相關 活動 資訊 請 新北市 中 區公所 網站     ENG       ENG       ENG       ENG       ENG       ENG     查詢   新北市 中和區 辦理     NUM   年 越 越欲試   藝起 童樂會   活動 文宣 
28,公告,板橋 區 愛心 團體 捐 電扇 助 弱勢 家庭   板橋 訊   本區 弱勢 族群 渡過 炎炎夏日   板橋 區公所 連結 資源   善心 團體 捐助 電扇 分 送給 弱勢 家庭   希望 弱勢 族群 夏天 酷暑 高溫 感受 社會 關懷   本次 愛心 電扇 發放 活動   本區 善心 團體 捐贈   NUM   台 直立式 電扇 予本   預計 將在 本月   NUM   日至   NUM   日 發放   發放 對象 主要 本區 低收入 戶 弱勢 獨居 長者   預估 將有   NUM   戶 弱勢 家庭 受惠   本次 善心 團體 捐贈 電扇   台灣 製造 節能 省電 電扇   實用 環保   弱勢 家庭 將老舊 電風扇 汰舊換新   渡過 夏日 炎炎 酷暑   板橋 區公所 林敬 榜 區長 表示   本次 電扇 發放 活動   感謝 本區 愛心 團體 長期 默默 付出   慷慨解囊 回饋 鄉里   定期 捐助 物資   季節 捐贈 相關 實用 物資   弱勢 家庭 食衣 不虞匱乏   期許 善心 仍夠 拋磚引玉   獲得 善心人士 迴響   實質 行動 愛心   共同 弱勢 族群 送上 最 溫暖 關懷   新北市 板橋 區公所   資料 提供   社會 課   張紀薇   電話     NUM   分機   NUM   
29,公告,  NUM   學年 大學 儲備 軍官 訓練團 甄選 簡章 修正 對照表 推動 分級 醫療   落實 雙向 轉診   就醫請 先到 基層 院所   病情 需要 再 轉診   相關 訊息 請到 健保署 全球 資訊網     ENG       ENG       ENG       ENG     查詢   
30,公告,    NUM   恆春 古城 國際 豎孤棚 觀光 文化 活動   豎孤棚 競賽 豎孤棚 競賽 報名   NUM   月   NUM   日起   NUM   月   NUM   日 截止   額滿 為止   相關 活動 訊息 豎 孤棚 競賽 報名表 請 網站     ENG       ENG       ENG       ENG       ENG     查詢 下載   洽詢 本所觀 農課     NUM       NUM     
31,教育,  認識 臺灣   愛 寶島   課程 內政部 移民 署 課程 行銷 活動   訂於   NUM   月   NUM   日起   NUM   月   NUM   日 辦理   認識 臺灣   愛 寶島   課程 行銷 活動   直播 共學   線上 課程   提供 新 住民 參與 學習   活動 資訊 請參閱   新 住民 資訊 Ｅ 網   網   站     ENG       ENG       ENG       ENG       ENG     洽詢 諮詢 專線   NUM       NUM       NUM     
32,文藝,  NUM   冬山 茶藝 文化節 系列 活動     NUM   冬山 茶藝 文化節 系列 活動   訂於   NUM   年   NUM   月   NUM       NUM   日假 宜蘭縣 冬 山鄉 鄉政 中心 舉辦   
33,休閒,  NUM   恆春 古城 國際 豎孤棚 觀光 文化 活動   系列 活動 訂於   NUM   年   NUM   月   NUM   日   星期三   假 恆春 古城 東門 旁 廣場 辦理     豎孤棚 競賽 報名   NUM   月   NUM   日起   NUM   月   NUM   日 截止   額滿 為止   相關 活動 訊息 豎 孤棚 競賽 報名表 請 屏東縣 恆春鎮 公所 網站     ENG       ENG       ENG       ENG       ENG     查詢 下載   洽詢 恆春鎮 公所 觀農課     NUM       NUM       以上 活動 內容 變更   屏東縣 恆春鎮 公所 網站 網站 公告 為主   發佈 課室   經建課 
34,公告,  不可 不知 狂犬病   防疫 宣導 鼬獾 感染 狂犬病 具 主動 攻擊性   民眾 稍有不慎 遭 抓 咬傷   請 惠予 配合 宣導 民眾 應 避開 野生動物 冒險 捕捉   確保 安全   不慎 動物 咬傷 時   確遵   NUM     記   保持 冷靜   牢記 動物 特徵     NUM     沖   大量 肥皂   清水 沖洗   NUM   分鐘   並以 優 碘 消毒 傷口     NUM     送   儘速 送醫 評估 是否 接種 疫苗     NUM     觀   將咬人 動物 繫留 觀察   NUM   天   
